{
  "fn": "enqueue_job",
  "action": "agl.close_validation",
  "idempotency_key": "agl-closure-validation-2026-04-24-chatgpt",
  "payload": {
    "target_repo": "TML-4PM/t4h-remote-mcp-server-clean",
    "target_endpoint": "https://t4h-remote-mcp-server-clean.vercel.app/mcp",
    "wip_payload_path": "wip/agl-closure-2026-04-24.md",
    "wip_commit": "428b437fea07460689ea840c591550855428c481",
    "deployed_commit": "bdc12a8c8abd45db6719d7818e5057305fa90129",
    "required_sequence": [
      "apply_sql_migration_from_wip_payload",
      "enqueue_validation_job_with_dedupe_key_agl_closure_validation_2026_04_24",
      "trigger_worker_process_work_queue",
      "verify_ops_work_queue",
      "verify_audit_log",
      "write_runtime_receipt"
    ],
    "pass_criteria": {
      "queue_row_exists": true,
      "dedupe_unique_index_exists": true,
      "rls_enabled_ops_work_queue": true,
      "rls_enabled_audit_log": true,
      "audit_work_enqueued": true,
      "audit_worker_triggered": true,
      "validation_job_terminal_state": "completed_or_failed_with_error_evidence"
    },
    "no_delete": true,
    "archive_only": true,
    "receipt_expected_prefix": "receipts/runtime/agl-closure-validation-2026-04-24"
  },
  "priority": 5,
  "meta": {
    "actor": "troy",
    "source": "chatgpt",
    "ts": "2026-04-24T07:20:00Z",
    "constraint": "global/CLAUDE_CONTAINER_CONSTRAINT.md@3d4fbfb",
    "execution_primitive": "pen_inbox_commit"
  }
}
